{
  "id": "3",
  "subject": "Implement /synthesis skill (P0)",
  "description": "## 목표\n추적성 매트릭스 생성, 품질 검증, 완료 결정을 수행하는 /synthesis 스킬 구현\n\n## 위치\n`.claude/skills/synthesis/SKILL.md`\n\n## 구현 요구사항\n1. **/clarify 로그** 읽기 (원본 요구사항)\n2. **/collect 보고서** 읽기 (집계 결과)\n3. **교차 참조**: requirements ↔ deliverables\n4. **품질 검사** (일관성, 충돌, 완전성)\n5. **추적성 매트릭스** 생성\n6. **결정**: COMPLETE (→ commit-push-pr) 또는 ITERATE (→ clarify)\n\n## Frontmatter 요구사항 (V2.1.19)\n```yaml\n---\nname: synthesis\ndescription: Traceability matrix, quality validation, completion decision\nuser-invocable: true\nmodel: opus\ncontext: standard\nversion: \"1.0.0\"\n---\n```\n\n## 의존성\n- /collect 스킬 완료 후 진행 (collect 출력 형식 참조 필요)\n\n## 완료 기준\n- [ ] SKILL.md 파일 생성\n- [ ] Clarify 로그 파싱 로직\n- [ ] Collect 보고서 파싱 로직\n- [ ] 추적성 매트릭스 생성\n- [ ] COMPLETE/ITERATE 결정 로직",
  "activeForm": "Implementing /synthesis skill",
  "owner": "terminal-b",
  "status": "completed",
  "blocks": [
    "4"
  ],
  "blockedBy": [
    "2"
  ]
}