{
  "id": "6",
  "subject": "Explore: New Skills (collect, synthesis, worker)",
  "description": "**목표:** 새로 구현된 스킬 3개의 코드 레벨 분석\n\n**대상 스킬:**\n1. `/collect` - 결과 수집 로직\n2. `/synthesis` - 추적성 매트릭스, 품질 검증\n3. `/worker` - Worker 셀프서비스 명령어\n\n**분석 항목:**\n- SKILL.md frontmatter V2.1.19 준수 여부\n- 정의된 함수가 실제 동작 가능한지\n- 파이프라인의 이전/다음 스킬과 인터페이스 호환성\n- 누락된 helper 함수 또는 스크립트\n\n**출력:**\n`.agent/outputs/explore/new-skills-analysis.md`",
  "activeForm": "Exploring new skills implementation",
  "owner": "terminal-b",
  "status": "pending",
  "blocks": [
    "7"
  ],
  "blockedBy": []
}