{
  "id": "3",
  "subject": "Implement /assign skill",
  "description": "Create /assign skill that assigns tasks to workers using TaskUpdate(owner=\"terminal-X\"), updates _progress.yaml, supports both manual and auto-assignment modes",
  "activeForm": "Implementing /assign skill",
  "status": "pending",
  "blocks": [
    "7"
  ],
  "blockedBy": [
    "1"
  ]
}