{
  "id": "1",
  "subject": "Design hybrid orchestration architecture",
  "description": "Design the integration of Native Task System (TaskCreate/Update/List/Get) with file-based worker prompts (.agent/prompts/). Define skill responsibilities: /orchestrate (task decomposition + TaskCreate), /assign (TaskUpdate owner), /worker (individual worker ops), /workers (monitor all), /collect (aggregate results)",
  "activeForm": "Designing hybrid orchestration architecture",
  "status": "completed",
  "blocks": [
    "2",
    "3",
    "4",
    "5",
    "6"
  ],
  "blockedBy": []
}